thesis_id,theme,thesis_title,thesis_summary,key_drivers,risks,status,conviction,last_reviewed
thesis_001,AI Accelerator,Accelerator demand remains structurally strong,Training and inference workloads continue to require more accelerator capacity across hyperscalers enterprises and AI labs.,Model scaling demand; inference adoption; cloud capex competition,Customer digestion cycles; ASIC substitution; export controls,Active,High,2025-10-15
thesis_002,Advanced Packaging,Packaging capacity is a key AI supply bottleneck,Advanced packaging remains critical because leading AI accelerators need high bandwidth memory and complex chiplet integration.,CoWoS demand; HBM attach rates; foundry investment,Capacity additions overshooting demand; yield constraints,Active,High,2025-10-10
thesis_003,HBM,HBM is becoming a strategic memory profit pool,AI accelerators need increasing HBM content which can improve memory supplier mix and margins.,Higher HBM stacks; accelerator launches; tight supply,Active,Medium,2025-10-05
thesis_004,Power,Power availability constrains AI data center growth,High density AI clusters increase demand for power distribution thermal management and backup power infrastructure.,Rack density growth; grid constraints; data center backlog,Project delays; customer capex pauses; competition,Active,High,2025-09-28
thesis_005,Networking,Cluster networking remains underappreciated,AI training clusters require high performance switching interconnect and software stacks to keep accelerators utilized.,Scale-out architectures; Ethernet adoption; bundled platforms,Standards fragmentation; hyperscaler internal silicon,Watching,Medium,2025-09-20
thesis_006,ASIC,Custom AI silicon will coexist with GPUs,Large cloud customers will use ASICs for cost and workload optimization while GPUs remain flexible general purpose platforms.,Hyperscaler scale; inference optimization; supply diversification,Design concentration; software friction; lower merchant TAM,Watching,Medium,2025-09-18
