action_id,created_date,action_title,related_company_id,related_thesis_id,related_evidence_id,priority,status,reason,next_step,due_date,last_updated
action_001,2025-10-16,Review Micron latest earnings call for HBM margin commentary,mu,thesis_003,ev_003,High,Open,HBM pricing evidence is supportive but company-specific margin commentary is still needed.,Read latest earnings transcript and capture any HBM qualification margin and capacity comments.,2025-11-05,2025-10-16
action_002,2025-10-16,Compare Delta Electronics vs Vertiv AI power exposure,vertiv,thesis_004,ev_004,High,In Progress,Power infrastructure thesis needs a clearer view of which suppliers have direct AI data center exposure.,Compare backlog product mix and AI data center customer commentary for Vertiv and Delta Electronics.,2025-11-12,2025-10-18
action_003,2025-10-17,Check whether liquid cooling adoption is accelerating,smci,thesis_005,ev_005,Medium,Open,Liquid cooling is central to high density racks but adoption timing remains uncertain.,Review recent server platform announcements and customer deployment comments.,2025-11-18,2025-10-17
action_004,2025-10-18,Review ON Semiconductor power semiconductor exposure,on,thesis_008,ev_008,Medium,Open,AI rack power evidence suggests possible component demand but direct exposure needs confirmation.,Look for ON Semiconductor commentary on data center power silicon revenue and design wins.,2025-11-22,2025-10-18
action_005,2025-10-18,Review Power Infrastructure thesis after new capex evidence,vertiv,thesis_004,ev_004,High,Waiting,Power constraints remain supportive but thesis conviction should be reviewed after new capex commentary.,Wait for next hyperscaler capex updates then compare against power equipment backlog signals.,2025-12-05,2025-10-18
action_006,2025-10-19,Separate GPU demand from ASIC substitution risk,nvda,thesis_001,ev_006,Medium,Open,Accelerator demand is strong but competitive evidence challenges how much demand flows to merchant GPUs.,Compare NVIDIA AMD Broadcom and hyperscaler ASIC commentary by workload type.,2025-11-29,2025-10-19
action_007,2025-10-20,Archive completed Broadcom ASIC evidence review,avgo,thesis_007,ev_007,Low,Done,Broadcom custom silicon customer-win evidence has already been added to the knowledge layer.,No next step required unless new customer concentration evidence appears.,2025-10-25,2025-10-22
